{
  "$schema": "./schemas/kernel-boundary.schema.json",
  "schema_version": "1.0",
  "trusted_modules": [
    "kernel_boundary",
    "platform_identity",
    "trusted_assurance",
    "evidence_verify",
    "required_checks",
    "github_controls",
    "hardening_audit",
    "scope_guard",
    "onecompany_lib",
    "ledger_lib",
    "lease_lifecycle",
    "planning_lib",
    "capacity_lib",
    "assurance",
    "simulate_assurance_legacy",
    "assurance_gate",
    "gate",
    "merge",
    "merge_lane"
  ],
  "trusted_data": [
    ".onecompany/identity.json",
    ".onecompany/kernel-boundary.json",
    ".onecompany/required-checks.json",
    ".onecompany/quality.json",
    ".onecompany/governance.json",
    ".onecompany/ledger.json"
  ],
  "forbidden_repo_import_roots": [
    "company",
    "app",
    "src",
    "project",
    "product"
  ]
}
